0;Algoritmos e Representações;ICFA01;ICFA02
1;Apostila de Introdução à Programação;ICFA01;ICFA02
2;Algoritmo e Formas de Representação;ICFA01;ICFA02
3;Algoritmos_Conceito e Formas de Representação;ICFA01;ICFA02
4;Conceito e Representações de Algoritmos;ICFA01;ICFA02
5;Algoritmo - Introdução, definição e conceitos;ICFA01;ICFA02
6;Definição de Algoritmo e Exemplos Heurísticos;ICFA01
7;Algoritmo, Problemas e Soluções;ICFA01
8;Definição de Algoritmo e Exemplo;ICFA01
9;Algoritmos e Programas;ICFA01
10;Algoritmo;ICFA01
11;Algoritmo e Programa;ICFA01
12;O que é Algoritmo e Exemplos;ICFA01
13;Definição de Algoritmo;ICFA01
14;Definição de Algoritmo e Programa;ICFA01
15;O que é um Algoritmo e exemplo;ICFA01
16;O que é um Algoritmo;ICFA01
17;Representação de Algoritmo;ICFA02
18;Tipos de Representação de Algoritmos;ICFA02
19;Formas de representao de algoritmos;ICFA02
20;Representações de Algoritmos;ICFA02
21;Representação de um Algoritmo;ICFA02
22;Tipos de algoritmo;ICFA02
23;Representação de Algoritmos com exemplos;ICFA02
24;Representações;ICFA02
25;Diagrama Representação de Algoritmos;ICFA02
26;Algoritmos e Representações;ICAF02
27;Paradigmas de programação e Linguagem;ICFA03
28;Paradigmas de Programação e características das Linguagens;ICFA03
29;Paradigmas de Programação - Resumo;ICFA03
30;Paradigmas de Programação;ICFA03
31;Esclarecendo Paradigmas de Programação;ICFA03
32;Noção sobre Linguagem e Paradigma de Programação;ICFA03
33;Um pouco sobre Linguagem e Paradigma de Programação;ICFA03
34;Linguagem e Paradigma de Programação;ICFA03
35;Diagrama Paradigmas de Programação;ICFA03
36;Paradigmas de Programação e utilização;ICFA03
37;Linguagem de Programação e Paradigmas de Programação;ICFA03
38;Linguagens e paradigmas de programação;ICFA03